{
  "$schema": "https://raw.githubusercontent.com/4evy/patches/master/schema/stack-v1.schema.json",
  "manifestVersion": 1,
  "id": "jj",
  "source": {
    "vcs": "git",
    "canonical": "https://github.com/jj-vcs/jj.git",
    "revision": "df92b83d7d1141cd51aabf0dd744bb365d62ae3b",
    "trackingRef": "refs/heads/main",
    "endpoints": [
      {
        "url": "https://github.com/jj-vcs/jj.git",
        "role": "primary",
        "priority": 0
      }
    ],
    "checkout": {
      "submodules": false,
      "lfs": false
    }
  },
  "result": {
    "tree": {
      "algorithm": "sha1",
      "oid": "ddd0bfed8f9d4d356aa68c5f10b55d7534a79099"
    }
  }
}
